{
  "schemaVersion": "2.0",
  "id": "AV-DSP-AV-GEAR-2026-05-17",
  "contentClass": "dispatch",
  "publicationClass": "release-note",
  "title": "AV Gear Shop Overlay Cleanup",
  "summary": "Release-note dispatch documenting AV Gear storefront cleanup, clearer product presentation, and smoother checkout flow.",
  "owner": "AeroVista LLC",
  "status": "final",
  "audience": [
    "internal",
    "stakeholder",
    "public"
  ],
  "formats": [
    "html"
  ],
  "issuedAt": "2026-05-17",
  "canonicalUrl": "https://thesignal.aerovista.us/dispatches/topics/av-gear-shop-overlay-cleanup.html",
  "canonicalPath": "dispatches/topics/av-gear-shop-overlay-cleanup.html",
  "tags": [
    "av-gear",
    "storefront",
    "release-note"
  ],
  "package": {
    "mode": "legacy-flat",
    "root": "dispatches/topics",
    "strict": false,
    "portable": true
  },
  "supersedes": null,
  "files": [
    {
      "id": "primary-html",
      "role": "primary",
      "relationship": "owned",
      "path": "dispatches/topics/av-gear-shop-overlay-cleanup.html",
      "name": "av-gear-shop-overlay-cleanup.html",
      "fileType": "html",
      "mediaType": "text/html",
      "sizeBytes": 5340,
      "integrity": {
        "gitBlobSha1": "7c9c1709c0fdd324ecbe763660c194c1aa606a3a",
        "sha256": "b25affb7d03829c5d7dfad39e0123adedc10383323daf2a6fc7c13584fc7c198"
      }
    },
    {
      "id": "legacy-redirect",
      "role": "redirect",
      "relationship": "referenced",
      "path": "dispatches/av-gear-shop-overlay-cleanup.html",
      "name": "av-gear-shop-overlay-cleanup.html",
      "fileType": "html",
      "mediaType": "text/html",
      "sizeBytes": 557,
      "integrity": {
        "gitBlobSha1": "f93e5ac91f96e588481943f578ac047fcd58bd89",
        "sha256": "49eccb6bc857046ac74e482ee15eaab032fad7d369362894f15ec1df16a2af1b"
      }
    }
  ],
  "references": []
}
