{
  "schemaVersion": "2.0",
  "id": "AV-RPT-EOM-2026-07",
  "reportId": "AV-RPT-EOM-2026-07",
  "contentClass": "report",
  "reportClass": "eom",
  "title": "July Convergence",
  "summary": "Interactive July 2026 end-of-month hub with executive brief, six report sections, six-part ByteCast series, images, metadata, and source evidence.",
  "status": "final",
  "owner": "AeroVista LLC",
  "audience": [
    "internal",
    "executive",
    "stakeholder",
    "shareholder"
  ],
  "formats": [
    "interactive-html",
    "multi-report",
    "bytecast-series",
    "infographic"
  ],
  "period": {
    "start": "2026-07-01",
    "end": "2026-07-31"
  },
  "issuedAt": "2026-07-31",
  "canonicalUrl": "https://thesignal.aerovista.us/newsletters/editions/eom/2026-07-31-july-convergence/",
  "canonicalPath": "newsletters/editions/eom/2026-07-31-july-convergence/index.html",
  "tags": [
    "july-2026",
    "eom",
    "convergence",
    "portfolio",
    "bytecast-series"
  ],
  "package": {
    "mode": "directory",
    "root": "newsletters/editions/eom/2026-07-31-july-convergence",
    "strict": true,
    "portable": true
  },
  "supersedes": null,
  "files": [
    {
      "id": "index-html",
      "role": "primary",
      "relationship": "owned",
      "path": "newsletters/editions/eom/2026-07-31-july-convergence/index.html",
      "name": "index.html",
      "fileType": "html",
      "mediaType": "text/html",
      "sizeBytes": 7507,
      "integrity": {
        "gitBlobSha1": "7205a04c1a6ba87c771c12ef2fdefe73f2b95b19",
        "sha256": "0f020036c5ba04d7004a2816d48d97b41d6721305931c1724779bac6d3d194c6"
      }
    },
    {
      "id": "meta-json",
      "role": "metadata",
      "relationship": "owned",
      "path": "newsletters/editions/eom/2026-07-31-july-convergence/meta.json",
      "name": "meta.json",
      "fileType": "json",
      "mediaType": "application/json",
      "sizeBytes": 557,
      "integrity": {
        "gitBlobSha1": "ac11c23efcbff878c496af016218f26df0c0ab68",
        "sha256": "d1cda155339f784ea93096e3cb9c934732ef621931d9267f1b263f89bed5c89c"
      }
    },
    {
      "id": "legacy-newsletters-aerovista-july-2026-month-end-signal-html",
      "role": "redirect",
      "relationship": "referenced",
      "path": "newsletters/aerovista_july_2026_month_end_signal.html",
      "name": "aerovista_july_2026_month_end_signal.html",
      "fileType": "html",
      "mediaType": "text/html",
      "sizeBytes": 528,
      "integrity": {
        "gitBlobSha1": "3f99661efd5ca1d316e15d89ece312537fc3e6b3",
        "sha256": "d5e664483487a59172daa7d103f8d376d1efb877d5e528adaa40727eb4b19a70"
      },
      "description": "Legacy local alias or duplicate retained for compatibility; preserve or redirect during migration."
    }
  ],
  "references": [
    {
      "type": "legacy-catalog-id",
      "value": "eom-2026-07-31-july-convergence"
    },
    {
      "type": "legacy-url",
      "value": "/newsletters/aerovista_july_2026_month_end_signal.html"
    },
    {
      "type": "protected-package",
      "value": "mag-auth:AV-RPT-EOM-2026-07",
      "description": "Private preserved July Convergence package in mag-auth protected delivery."
    }
  ],
  "access": {
    "mode": "entitled",
    "capabilities": [
      "publication.issue.read"
    ],
    "notes": "Public Signal delivery exposes only the Account entitlement gate, safe metadata, and legacy redirect. The full July EOM package is delivered by mag-auth after AeroVista Account session validation and resource-scoped publication.issue.read authorization for publication_issue:AV-RPT-EOM-2026-07."
  }
}
