{
  "schemaVersion": "2.0",
  "id": "AV-RPT-EOW-2026-05-23",
  "reportId": "AV-RPT-EOW-2026-05-23",
  "contentClass": "report",
  "reportClass": "eow",
  "title": "Shareholder Update",
  "summary": "Earlier weekly AeroVista shareholder update covering momentum, priorities, wins, risks, and what comes next.",
  "status": "final",
  "owner": "AeroVista LLC",
  "audience": [
    "internal",
    "executive",
    "stakeholder",
    "shareholder"
  ],
  "formats": [
    "html"
  ],
  "period": {
    "start": "2026-05-17",
    "end": "2026-05-23"
  },
  "issuedAt": "2026-05-23",
  "canonicalUrl": "https://thesignal.aerovista.us/dispatches/eow/shareholder-update.html",
  "canonicalPath": "dispatches/eow/shareholder-update.html",
  "tags": [
    "may-2026",
    "eow",
    "shareholder-update",
    "archive"
  ],
  "package": {
    "mode": "legacy-flat",
    "root": "dispatches/eow",
    "strict": false,
    "portable": true
  },
  "supersedes": null,
  "files": [
    {
      "id": "primary-html",
      "role": "primary",
      "relationship": "owned",
      "path": "dispatches/eow/shareholder-update.html",
      "name": "shareholder-update.html",
      "fileType": "html",
      "mediaType": "text/html",
      "sizeBytes": 5420,
      "integrity": {
        "gitBlobSha1": "dedb05d1719c2c71bb129f9f5dd1e92fdd06811e",
        "sha256": "6a1ebfc67db2c20b498cc8dd17bb8b629c0d4e828ec884529505ec5f29f81242"
      }
    },
    {
      "id": "legacy-dispatches-eow-shareholder-update-html",
      "role": "redirect",
      "relationship": "referenced",
      "path": "dispatches/eow-shareholder-update.html",
      "name": "eow-shareholder-update.html",
      "fileType": "html",
      "mediaType": "text/html",
      "sizeBytes": 514,
      "integrity": {
        "gitBlobSha1": "2224ab0a42f165e569005ad6c35918b6ca0de048",
        "sha256": "f56af5b25a3bac05ec11974852632083884493b8de47130882432a4459cb209f"
      },
      "description": "Legacy local alias or duplicate retained for compatibility; preserve or redirect during migration."
    }
  ],
  "references": [
    {
      "type": "legacy-catalog-id",
      "value": "eow-shareholder-update"
    }
  ]
}
