{
  "schemaVersion": "2.0",
  "id": "AV-RPT-EOM-2026-09",
  "reportId": "AV-RPT-EOM-2026-09",
  "contentClass": "report",
  "reportClass": "eom",
  "title": "The Pieces Start Working Together",
  "summary": "September 2026 end-of-month shareholder briefing and 19:34 ByteCast on AeroVista's shift from recovery toward repeatability across identity, field proof, operations, publishing, commerce, property planning, governance, and the next acceptance gates.",
  "status": "final",
  "owner": "AeroVista LLC",
  "audience": [
    "internal",
    "executive",
    "shareholder",
    "stakeholder"
  ],
  "formats": [
    "interactive-html",
    "bytecast"
  ],
  "period": {
    "start": "2026-09-01",
    "end": "2026-09-30"
  },
  "issuedAt": "2026-10-04",
  "canonicalUrl": "https://thesignal.aerovista.us/newsletters/editions/eom/2026-09-30-pieces-working-together/",
  "canonicalPath": "newsletters/editions/eom/2026-09-30-pieces-working-together/index.html",
  "tags": [
    "september-2026",
    "eom",
    "shareholder",
    "bytecast",
    "repeatability",
    "internal-signal"
  ],
  "package": {
    "mode": "directory",
    "root": "newsletters/editions/eom/2026-09-30-pieces-working-together",
    "strict": true,
    "portable": true
  },
  "supersedes": null,
  "files": [
    {
      "id": "audio-sept2026eom-mp3",
      "role": "audio",
      "relationship": "owned",
      "path": "newsletters/editions/eom/2026-09-30-pieces-working-together/audio/sept2026eom.mp3",
      "name": "sept2026eom.mp3",
      "fileType": "mp3",
      "mediaType": "audio/mpeg",
      "sizeBytes": 13351920,
      "integrity": {
        "gitBlobSha1": "642cee094ea84f6e2f5e2d6d093cb5628b28f06c",
        "sha256": "0befc8832961d05dac87fb74e0919166cc0c3f14d819340299902e04fe9c8be9"
      }
    },
    {
      "id": "edition-css",
      "role": "style",
      "relationship": "owned",
      "path": "newsletters/editions/eom/2026-09-30-pieces-working-together/edition.css",
      "name": "edition.css",
      "fileType": "css",
      "mediaType": "text/css",
      "sizeBytes": 10479,
      "integrity": {
        "gitBlobSha1": "fc969586ae8d1e966f16caec196787da44397dd9",
        "sha256": "881798cd7a410e81919acc86006caa893bcdfcbb7c8f2994d13492595d923407"
      }
    },
    {
      "id": "index-html",
      "role": "primary",
      "relationship": "owned",
      "path": "newsletters/editions/eom/2026-09-30-pieces-working-together/index.html",
      "name": "index.html",
      "fileType": "html",
      "mediaType": "text/html",
      "sizeBytes": 21314,
      "integrity": {
        "gitBlobSha1": "289d000fca860ce59ac1b13eff18177bdef5525b",
        "sha256": "307afa1db7d2d536cb9dac048265c9c7f489b13acbc91ebc92ae27880abbeeac"
      }
    },
    {
      "id": "meta-json",
      "role": "metadata",
      "relationship": "owned",
      "path": "newsletters/editions/eom/2026-09-30-pieces-working-together/meta.json",
      "name": "meta.json",
      "fileType": "json",
      "mediaType": "application/json",
      "sizeBytes": 1809,
      "integrity": {
        "gitBlobSha1": "72bdd55968e98bfd4a02a78a58b8d9b30e27a1ac",
        "sha256": "71678f3c9b667f6d39e9ae3ab0b5622fb35dc04ceffe324b1d57ee8905659e69"
      }
    }
  ],
  "references": [
    {
      "type": "source-draft",
      "value": "draft/eom-september-2026-audience-editions@0002ccc49adcc268785ce20f99a15bb105022d1d",
      "description": "Approved shareholder audience draft promoted into the governed September EOM package."
    }
  ]
}
