{
  "schemaVersion": "2.0",
  "id": "AV-PUB-WAR-LOOP",
  "contentClass": "publication",
  "publicationClass": "research-publication",
  "title": "The Borrowed War Loop",
  "summary": "Publication package containing The Borrowed War Loop PDF, magazine and briefing surfaces, teaser media, and supporting publication metadata. Existing package metadata appears partially inherited from VXP-MR-01 and remains flagged for reconciliation.",
  "status": "review",
  "owner": "AeroVista LLC",
  "audience": [
    "internal",
    "executive",
    "advisor"
  ],
  "formats": [
    "pdf",
    "interactive-html",
    "video"
  ],
  "issuedAt": "2026-06-16",
  "canonicalUrl": "https://thesignal.aerovista.us/publications/warLOOP/magazine.html",
  "canonicalPath": "publications/warLOOP/magazine.html",
  "tags": [
    "war-loop",
    "publication",
    "research",
    "vespera",
    "metadata-review"
  ],
  "package": {
    "mode": "directory",
    "root": "publications/warLOOP",
    "strict": true,
    "portable": true
  },
  "supersedes": null,
  "files": [
    {
      "id": "magazine-html",
      "role": "primary",
      "relationship": "owned",
      "path": "publications/warLOOP/magazine.html",
      "name": "magazine.html",
      "fileType": "html",
      "mediaType": "text/html",
      "sizeBytes": 5904,
      "integrity": {
        "gitBlobSha1": "472910948a28b85ad0210c6b05a60099d61d5dda",
        "sha256": "08e91bbce3afdb54295fd43d2941e0ca75009a21dd27a70cb71982a6fe37401b"
      }
    },
    {
      "id": "media-brief-teaser-mp4",
      "role": "video",
      "relationship": "owned",
      "path": "publications/warLOOP/media/brief-teaser.mp4",
      "name": "brief-teaser.mp4",
      "fileType": "mp4",
      "mediaType": "video/mp4",
      "sizeBytes": 6963184,
      "integrity": {
        "gitBlobSha1": "31420078cf01ec9090415933a4e2640be9a83bf7",
        "sha256": "2e6d47bba2ae80ddf9c8e16c888316f15c065804d26778857928bcc1b1477cce"
      }
    },
    {
      "id": "signals-briefing-html",
      "role": "primary",
      "relationship": "owned",
      "path": "publications/warLOOP/signals_briefing.html",
      "name": "signals_briefing.html",
      "fileType": "html",
      "mediaType": "text/html",
      "sizeBytes": 5793,
      "integrity": {
        "gitBlobSha1": "d580d577f4af59fc537a363eb9f01d27e3526841",
        "sha256": "c2babdfbfeecf2bfa24ccfb0de89361c1f6b67d507231ea527b09e72f9a81807"
      }
    }
  ],
  "references": [
    {
      "type": "metadata-review-note",
      "value": "vespera_publication_meta.yaml",
      "description": "Metadata appears inherited from VXP-MR-01 and should be reconciled before final status."
    },
    {
      "type": "protected-package",
      "value": "mag-auth:AV-PUB-WAR-LOOP",
      "description": "Private protected-delivery package. Runtime copy preserves the pre-migration Registry file hashes."
    }
  ],
  "access": {
    "mode": "authenticated",
    "notes": "Public Signal delivery exposes only Account gate shells and the teaser. The full review-status PDF, briefing, reader package, and supporting files are delivered by mag-auth after AeroVista Account session validation."
  }
}
