{
  "schemaVersion": "2.0",
  "id": "AV-PUB-VXP-MR-01",
  "contentClass": "publication",
  "publicationClass": "research-intelligence",
  "title": "Tokenized Rails, Collateral Systems, and the Physical Internet of Money",
  "summary": "Vespera × AeroVista internal strategy publication spanning regulatory rails, tokenized treasuries, collateral systems, banking infrastructure, geopolitics, and AI-energy physical rails.",
  "status": "final",
  "owner": "AeroVista Macro & Rails Desk",
  "audience": [
    "internal",
    "executive",
    "advisor"
  ],
  "formats": [
    "interactive-html",
    "magazine",
    "video",
    "research-volumes",
    "infographics"
  ],
  "issuedAt": "2026-05-27",
  "canonicalUrl": "https://thesignal.aerovista.us/publications/VXP-MR-01-macro-rails-intelligence/magazine.html",
  "canonicalPath": "publications/VXP-MR-01-macro-rails-intelligence/magazine.html",
  "tags": [
    "vespera",
    "macro-rails",
    "strategy",
    "research",
    "internal-intelligence"
  ],
  "package": {
    "mode": "directory",
    "root": "publications/VXP-MR-01-macro-rails-intelligence",
    "strict": true,
    "portable": true
  },
  "supersedes": null,
  "files": [
    {
      "id": "cover-png",
      "role": "image",
      "relationship": "owned",
      "path": "publications/VXP-MR-01-macro-rails-intelligence/cover.png",
      "name": "cover.png",
      "fileType": "png",
      "mediaType": "image/png",
      "sizeBytes": 2036337,
      "integrity": {
        "gitBlobSha1": "a1764dc7e1ed9fa754305070bf8474ea7ea055cc",
        "sha256": "9e914eacb62391a92563febd11ffda92201f090171efb126818529ff09dde1c8"
      }
    },
    {
      "id": "magazine-html",
      "role": "primary",
      "relationship": "owned",
      "path": "publications/VXP-MR-01-macro-rails-intelligence/magazine.html",
      "name": "magazine.html",
      "fileType": "html",
      "mediaType": "text/html",
      "sizeBytes": 6229,
      "integrity": {
        "gitBlobSha1": "9bbeb43ddc0fd26ccaa9a0c0a1dc4efd756569d9",
        "sha256": "70927e58c8485cb1279e141542ba4ef5299b4889447831a39ba41d21ba59e57e"
      }
    },
    {
      "id": "media-brief-teaser-mp4",
      "role": "video",
      "relationship": "owned",
      "path": "publications/VXP-MR-01-macro-rails-intelligence/media/brief-teaser.mp4",
      "name": "brief-teaser.mp4",
      "fileType": "mp4",
      "mediaType": "video/mp4",
      "sizeBytes": 6963184,
      "integrity": {
        "gitBlobSha1": "31420078cf01ec9090415933a4e2640be9a83bf7",
        "sha256": "2e6d47bba2ae80ddf9c8e16c888316f15c065804d26778857928bcc1b1477cce"
      }
    },
    {
      "id": "signals-briefing-html",
      "role": "primary",
      "relationship": "owned",
      "path": "publications/VXP-MR-01-macro-rails-intelligence/signals_briefing.html",
      "name": "signals_briefing.html",
      "fileType": "html",
      "mediaType": "text/html",
      "sizeBytes": 5929,
      "integrity": {
        "gitBlobSha1": "53a865ee6facf4c32cec04208d6af0ca3ad8dd2a",
        "sha256": "d90863bf276cba9f22ad21a873115d9c6d06ae9ed746c433e26060bf3bc38cb7"
      }
    }
  ],
  "references": [
    {
      "type": "issue-code",
      "value": "VXP-MR-01"
    },
    {
      "type": "protected-package",
      "value": "mag-auth:AV-PUB-VXP-MR-01",
      "description": "Private protected-delivery package. Runtime copy preserves the pre-migration Registry file hashes."
    }
  ],
  "access": {
    "mode": "authenticated",
    "notes": "Public Signal delivery exposes only the gate shell, cover, and teaser. Full publication package is delivered by mag-auth after AeroVista Account session validation."
  }
}
