{
  "schemaVersion": "2.0",
  "id": "AV-DSP-EOD-CURRENT",
  "contentClass": "dispatch",
  "title": "Current EOD Operating Note",
  "summary": "Mutable daily operating-note surface for what moved, what needs review, risks, and next actions. It is a current view, not an immutable formal report.",
  "status": "review",
  "owner": "AeroVista LLC",
  "audience": [
    "internal",
    "operations",
    "staff"
  ],
  "formats": [
    "html"
  ],
  "issuedAt": "2026-07-10",
  "canonicalUrl": "https://thesignal.aerovista.us/dispatches/eod/current-operating-note.html",
  "canonicalPath": "dispatches/eod/current-operating-note.html",
  "tags": [
    "current",
    "eod",
    "operating-note",
    "dispatch"
  ],
  "package": {
    "mode": "legacy-flat",
    "root": "dispatches/eod",
    "strict": false,
    "portable": false
  },
  "supersedes": null,
  "files": [
    {
      "id": "primary-html",
      "role": "primary",
      "relationship": "owned",
      "path": "dispatches/eod/current-operating-note.html",
      "name": "current-operating-note.html",
      "fileType": "html",
      "mediaType": "text/html",
      "sizeBytes": 4279,
      "integrity": {
        "gitBlobSha1": "648bfd47d4f251891ff364fe80629ea1de2f0507",
        "sha256": "656d4f529eefd0737024d66efefd9dd74d5cc1f0651373992c032d2ef0f6ecf1"
      }
    },
    {
      "id": "legacy-dispatches-eod-current-operating-note-html",
      "role": "redirect",
      "relationship": "referenced",
      "path": "dispatches/eod-current-operating-note.html",
      "name": "eod-current-operating-note.html",
      "fileType": "html",
      "mediaType": "text/html",
      "sizeBytes": 534,
      "integrity": {
        "gitBlobSha1": "f6981e4f5621333a9a6299f9f67c97a4ff5b2944"
      },
      "description": "Legacy local alias or duplicate retained for compatibility; preserve or redirect during migration."
    }
  ],
  "references": [
    {
      "type": "legacy-catalog-id",
      "value": "eod-current"
    }
  ]
}
