{
  "schemaVersion": "2.0",
  "id": "AV-DSP-HYDRILLA-GORILLA-2026-05-24",
  "contentClass": "dispatch",
  "publicationClass": "creative-drop",
  "title": "Hydrilla Gorilla EchoStory",
  "summary": "Creative-drop dispatch blending music, story, visual identity, and web experience under the EchoVerse Audio banner.",
  "owner": "AeroVista LLC",
  "status": "final",
  "audience": [
    "internal",
    "stakeholder",
    "public"
  ],
  "formats": [
    "html"
  ],
  "issuedAt": "2026-05-24",
  "canonicalUrl": "https://thesignal.aerovista.us/dispatches/topics/hydrilla-gorilla-echostory.html",
  "canonicalPath": "dispatches/topics/hydrilla-gorilla-echostory.html",
  "tags": [
    "echoverse",
    "creative-drop",
    "hydrilla-gorilla"
  ],
  "package": {
    "mode": "legacy-flat",
    "root": "dispatches/topics",
    "strict": false,
    "portable": true
  },
  "supersedes": null,
  "files": [
    {
      "id": "primary-html",
      "role": "primary",
      "relationship": "owned",
      "path": "dispatches/topics/hydrilla-gorilla-echostory.html",
      "name": "hydrilla-gorilla-echostory.html",
      "fileType": "html",
      "mediaType": "text/html",
      "sizeBytes": 5405,
      "integrity": {
        "gitBlobSha1": "21e27c1f3ae20688c453ed4169187f9076e15ab7",
        "sha256": "6ec6eaed9a83af251def6142b5a652465c948ae2d6d1372d65c7da7ffe71fa3f"
      }
    },
    {
      "id": "legacy-redirect",
      "role": "redirect",
      "relationship": "referenced",
      "path": "dispatches/hydrilla-gorilla-echostory.html",
      "name": "hydrilla-gorilla-echostory.html",
      "fileType": "html",
      "mediaType": "text/html",
      "sizeBytes": 563,
      "integrity": {
        "gitBlobSha1": "b6f7dbc70c2a96277bd6715a9755d2018b9e62fd",
        "sha256": "9ced8ae448c958f05c6e9d31f65d19ab271a21693ca1e2a52feb8291278b6353"
      }
    }
  ],
  "references": []
}
