{
  "schemaVersion": "2.0",
  "id": "AV-RPT-EOW-2026-10-07",
  "reportId": "AV-RPT-EOW-2026-10-07",
  "contentClass": "report",
  "reportClass": "eow",
  "title": "From Integration to Execution",
  "summary": "AeroVista retrospective public weekly report for October 01–07, 2026, documenting progress and remaining verification gates.",
  "status": "final",
  "owner": "AeroVista LLC",
  "audience": [
    "public",
    "stakeholder"
  ],
  "formats": [
    "interactive-html"
  ],
  "period": {
    "start": "2026-10-01",
    "end": "2026-10-07"
  },
  "issuedAt": "2026-10-20",
  "canonicalUrl": "https://thesignal.aerovista.us/newsletters/editions/weekly/2026-10-07-from-integration-to-execution/",
  "canonicalPath": "newsletters/editions/weekly/2026-10-07-from-integration-to-execution/index.html",
  "tags": [
    "october-2026",
    "eow",
    "public",
    "retrospective"
  ],
  "package": {
    "mode": "directory",
    "root": "newsletters/editions/weekly/2026-10-07-from-integration-to-execution",
    "strict": true,
    "portable": true
  },
  "supersedes": null,
  "files": [
    {
      "id": "assets-bytecast-mp3",
      "role": "audio",
      "relationship": "owned",
      "path": "newsletters/editions/weekly/2026-10-07-from-integration-to-execution/assets/bytecast.mp3",
      "name": "bytecast.mp3",
      "fileType": "mp3",
      "mediaType": "audio/mpeg",
      "sizeBytes": 2591832,
      "integrity": {
        "gitBlobSha1": "3c13f8fa283221c2b66c8db383bb82a5a7e94dc0",
        "sha256": "a263c55179b4d79731aeac9bcc286b63b5fbb86aabec0dd78d5931e1b498ebaa"
      }
    },
    {
      "id": "index-html",
      "role": "primary",
      "relationship": "owned",
      "path": "newsletters/editions/weekly/2026-10-07-from-integration-to-execution/index.html",
      "name": "index.html",
      "fileType": "html",
      "mediaType": "text/html",
      "sizeBytes": 17498,
      "integrity": {
        "gitBlobSha1": "afc44db6f4a644ef153c14b68d6e892a493988ef",
        "sha256": "98daf2edc5f2a1b6e66496e4ce6af823202e87ce94eb6aeb3cac72b8cb1d285a"
      }
    },
    {
      "id": "meta-json",
      "role": "metadata",
      "relationship": "owned",
      "path": "newsletters/editions/weekly/2026-10-07-from-integration-to-execution/meta.json",
      "name": "meta.json",
      "fileType": "json",
      "mediaType": "application/json",
      "sizeBytes": 597,
      "integrity": {
        "gitBlobSha1": "c27cc85103fc6f2801a4c7c20b2ff2e20e9063d5",
        "sha256": "d1e1f45a445429e6140449859b801725510e46d2df0f3f963d0c96378047d1bf"
      }
    }
  ],
  "references": []
}
