{
  "schemaVersion": "2.0",
  "id": "AV-RPT-EOW-2026-06-28",
  "reportId": "AV-RPT-EOW-2026-06-28",
  "contentClass": "report",
  "reportClass": "eow",
  "title": "Resilience Weekend",
  "summary": "Full weekly EOW ByteCast edition on AVCC recovery, Core Registry stabilization, deployment doctrine, and operational resilience.",
  "status": "final",
  "owner": "AeroVista LLC",
  "audience": [
    "internal",
    "staff",
    "stakeholder",
    "shareholder"
  ],
  "formats": [
    "interactive-html",
    "bytecast",
    "aac"
  ],
  "period": {
    "start": "2026-06-22",
    "end": "2026-06-28"
  },
  "issuedAt": "2026-06-28",
  "canonicalUrl": "https://thesignal.aerovista.us/newsletters/editions/weekly/2026-06-28-resilience-weekend/",
  "canonicalPath": "newsletters/editions/weekly/2026-06-28-resilience-weekend/index.html",
  "tags": [
    "june-2026",
    "eow",
    "weekly",
    "resilience-weekend",
    "recovery",
    "bytecast"
  ],
  "package": {
    "mode": "directory",
    "root": "newsletters/editions/weekly/2026-06-28-resilience-weekend",
    "strict": true,
    "portable": true
  },
  "supersedes": null,
  "files": [
    {
      "id": "index-html",
      "role": "primary",
      "relationship": "owned",
      "path": "newsletters/editions/weekly/2026-06-28-resilience-weekend/index.html",
      "name": "index.html",
      "fileType": "html",
      "mediaType": "text/html",
      "sizeBytes": 2417,
      "integrity": {
        "gitBlobSha1": "9b7d44858faeff85778bfcc711ce6d1e6dfa3f63",
        "sha256": "b9722de4c585d894ffc25071448d87217ff7ff35b48c5643aa2cef0171ab9c50"
      }
    },
    {
      "id": "meta-json",
      "role": "metadata",
      "relationship": "owned",
      "path": "newsletters/editions/weekly/2026-06-28-resilience-weekend/meta.json",
      "name": "meta.json",
      "fileType": "json",
      "mediaType": "application/json",
      "sizeBytes": 346,
      "integrity": {
        "gitBlobSha1": "df234eddcca799c16b4f16c2641b22717a73e403",
        "sha256": "fe6d8d615840587c2c7ea67a91233244785ba921a7591b105a85b8fadf3bf939"
      }
    },
    {
      "id": "legacy-newsletters-aerovista-weekend-report-6-28-26-html",
      "role": "redirect",
      "relationship": "referenced",
      "path": "newsletters/aerovista_weekend_report_6.28.26.html",
      "name": "aerovista_weekend_report_6.28.26.html",
      "fileType": "html",
      "mediaType": "text/html",
      "sizeBytes": 550,
      "integrity": {
        "gitBlobSha1": "0de2f411dc0d69d8ad976698e70d13a5d9f3a8dc",
        "sha256": "9876747e9a99cd1cc11980a99999fd53753d0ec933c9b3f4e5b64d7a7acfffe8"
      },
      "description": "Legacy local alias or duplicate retained for compatibility; preserve or redirect during migration."
    }
  ],
  "references": [
    {
      "type": "legacy-catalog-id",
      "value": "weekly-2026-06-28"
    },
    {
      "type": "protected-package",
      "value": "mag-auth:AV-RPT-EOW-2026-06-28",
      "description": "Private preserved report package."
    }
  ],
  "access": {
    "mode": "entitled",
    "capabilities": [
      "publication.issue.read"
    ],
    "notes": "Public delivery exposes only the Account entitlement gate, metadata, and legacy redirect. Full report and audio are delivered by mag-auth with resource-scoped authorization."
  }
}
