{
  "schemaVersion": "2.0",
  "id": "AV-RPT-MTD-2026-08-14",
  "reportId": "AV-RPT-MTD-2026-08-14",
  "contentClass": "report",
  "reportClass": "mtd",
  "title": "The Machine Is Taking Shape",
  "summary": "Self-contained August month-to-date interactive operating report with embedded 6:23 ByteCast audio and animated operating model.",
  "status": "final",
  "owner": "AeroVista LLC",
  "audience": [
    "internal",
    "executive",
    "stakeholder"
  ],
  "formats": [
    "interactive-html",
    "embedded-bytecast"
  ],
  "period": {
    "start": "2026-08-01",
    "end": "2026-08-14"
  },
  "issuedAt": "2026-08-15",
  "canonicalUrl": "https://thesignal.aerovista.us/newsletters/editions/mtd/2026-08-14-machine-taking-shape/",
  "canonicalPath": "newsletters/editions/mtd/2026-08-14-machine-taking-shape/index.html",
  "tags": [
    "august-2026",
    "mtd",
    "month-to-date",
    "bytecast",
    "operating-model"
  ],
  "package": {
    "mode": "directory",
    "root": "newsletters/editions/mtd/2026-08-14-machine-taking-shape",
    "strict": true,
    "portable": true
  },
  "supersedes": null,
  "files": [
    {
      "id": "index-html",
      "role": "primary",
      "relationship": "owned",
      "path": "newsletters/editions/mtd/2026-08-14-machine-taking-shape/index.html",
      "name": "index.html",
      "fileType": "html",
      "mediaType": "text/html",
      "sizeBytes": 7493,
      "integrity": {
        "gitBlobSha1": "d75f4a76bf6c9a068f1aaa75bcc7fb0ed3052571",
        "sha256": "dc9c4d9491060078729a7ea4d4de9711939eb99078d89bdd8b7b3ae099c98085"
      }
    },
    {
      "id": "legacy-mtd-html",
      "role": "redirect",
      "relationship": "referenced",
      "path": "newsletters/AeroVista_August_2026_MTD_Interactive_Report_with_ByteCast.html",
      "name": "AeroVista_August_2026_MTD_Interactive_Report_with_ByteCast.html",
      "fileType": "html",
      "mediaType": "text/html",
      "sizeBytes": 680,
      "integrity": {
        "gitBlobSha1": "03339d92f26eca1f9780081f4c7f5d53c6cf0b77",
        "sha256": "8312cb7c6d858600cc8272ed70ee075cea7f9d0f1e8b8249f94e5401916e8ea9"
      },
      "description": "Legacy MTD URL retained as a redirect to the normalized package."
    }
  ],
  "references": [
    {
      "type": "legacy-catalog-id",
      "value": "mtd-2026-08-15-machine-taking-shape"
    },
    {
      "type": "legacy-url",
      "value": "/newsletters/AeroVista_August_2026_MTD_Interactive_Report_with_ByteCast.html"
    },
    {
      "type": "protected-package",
      "value": "mag-auth:AV-RPT-MTD-2026-08-14",
      "description": "Private byte-identical protected report package; pre-migration SHA-256 retained in the private runtime manifest."
    }
  ],
  "access": {
    "mode": "entitled",
    "capabilities": [
      "publication.issue.read"
    ],
    "notes": "Public Signal delivery exposes only the Account entitlement gate and legacy redirect. The full report is delivered by mag-auth after AeroVista Account session validation and resource-scoped publication.issue.read authorization for publication_issue:AV-RPT-MTD-2026-08-14."
  }
}
