{
  "schemaVersion": "2.0",
  "id": "AV-RPT-EOW-2026-09-07",
  "reportId": "AV-RPT-EOW-2026-09-07",
  "contentClass": "report",
  "reportClass": "eow",
  "title": "From Convergence to Proof",
  "summary": "Internal EOW report for September 1–7, 2026: the first week of September turned August's convergence thesis into operating proof across AVCC, source control, release governance, productization, creative distribution, and staff endpoint operations.",
  "status": "final",
  "owner": "AeroVista LLC",
  "audience": [
    "internal",
    "executive",
    "operations",
    "staff",
    "stakeholder",
    "shareholder"
  ],
  "formats": [
    "interactive-html",
    "bytecast",
    "transcript",
    "webvtt-captions",
    "evidence-ledger"
  ],
  "period": {
    "start": "2026-09-01",
    "end": "2026-09-07"
  },
  "issuedAt": "2026-09-08",
  "canonicalUrl": "https://thesignal.aerovista.us/newsletters/editions/weekly/2026-09-07-from-convergence-to-proof/",
  "canonicalPath": "newsletters/editions/weekly/2026-09-07-from-convergence-to-proof/index.html",
  "tags": [
    "september-2026",
    "eow",
    "weekly",
    "convergence-to-proof",
    "avcc",
    "source-control",
    "release-governance",
    "phase",
    "rydesync",
    "internal-signal",
    "bytecast",
    "plain-language",
    "audio-companion"
  ],
  "package": {
    "mode": "directory",
    "root": "newsletters/editions/weekly/2026-09-07-from-convergence-to-proof",
    "strict": true,
    "portable": true
  },
  "supersedes": null,
  "files": [
    {
      "id": "assets-bytecast-mp3",
      "role": "audio",
      "relationship": "owned",
      "path": "newsletters/editions/weekly/2026-09-07-from-convergence-to-proof/assets/bytecast.mp3",
      "name": "bytecast.mp3",
      "fileType": "mp3",
      "mediaType": "audio/mpeg",
      "sizeBytes": 10046304,
      "integrity": {
        "gitBlobSha1": "819bdbc5abf27fbef393f3085bc408dba75a6579",
        "sha256": "09e3b9d35a573b700535b55bddcdd6d89ba594aec0fd39a351a53bc0ab770071"
      }
    },
    {
      "id": "bytecast-transcript-md",
      "role": "transcript",
      "relationship": "owned",
      "path": "newsletters/editions/weekly/2026-09-07-from-convergence-to-proof/bytecast-transcript.md",
      "name": "bytecast-transcript.md",
      "fileType": "md",
      "mediaType": "text/markdown",
      "sizeBytes": 14748,
      "integrity": {
        "gitBlobSha1": "a584f2fba82018e34b545a0db4327699f2234dd8",
        "sha256": "84380cec35b4a1c295449fcb039ef896734dc5ebc20362d1d7f6b8fbdf88d86c"
      }
    },
    {
      "id": "bytecast-vtt",
      "role": "transcript",
      "relationship": "owned",
      "path": "newsletters/editions/weekly/2026-09-07-from-convergence-to-proof/bytecast.vtt",
      "name": "bytecast.vtt",
      "fileType": "vtt",
      "mediaType": "text/vtt",
      "sizeBytes": 18415,
      "integrity": {
        "gitBlobSha1": "030fc2b0cf935957e473310a98969c42a6faa40a",
        "sha256": "2f2c2028171857afa66c09705be84de2399c209331caae97c032bd791963569c"
      }
    },
    {
      "id": "evidence-json",
      "role": "data",
      "relationship": "owned",
      "path": "newsletters/editions/weekly/2026-09-07-from-convergence-to-proof/evidence.json",
      "name": "evidence.json",
      "fileType": "json",
      "mediaType": "application/json",
      "sizeBytes": 4493,
      "integrity": {
        "gitBlobSha1": "4e9cae0deb0658a05a1b4bccbc8708b709d114ad",
        "sha256": "97bcf08e3c3d0d6cd8a7b47e5d8e9245018b43498e0203da66c03a95ade8f314"
      }
    },
    {
      "id": "index-html",
      "role": "primary",
      "relationship": "owned",
      "path": "newsletters/editions/weekly/2026-09-07-from-convergence-to-proof/index.html",
      "name": "index.html",
      "fileType": "html",
      "mediaType": "text/html",
      "sizeBytes": 33573,
      "integrity": {
        "gitBlobSha1": "23acd806a31acece73b3d8e564bd6287eb6c3e41",
        "sha256": "6e4c4ecc997114be2cdc81e10f872e0dc90e181d16415740df21a568902c91a8"
      }
    },
    {
      "id": "meta-json",
      "role": "metadata",
      "relationship": "owned",
      "path": "newsletters/editions/weekly/2026-09-07-from-convergence-to-proof/meta.json",
      "name": "meta.json",
      "fileType": "json",
      "mediaType": "application/json",
      "sizeBytes": 1467,
      "integrity": {
        "gitBlobSha1": "23af04c5799d98f11389070ef49535ac10a0b51e",
        "sha256": "c690d9c9232e56c827f9bef7b84039293b6a6cb8b8a7c32ee109c48336144edc"
      }
    }
  ],
  "references": [
    {
      "type": "narrative-predecessor",
      "value": "AV-RPT-EOM-2026-08",
      "description": "Continues the August EOM completion-and-proof arc."
    },
    {
      "type": "git-evidence",
      "value": "aerovista-us/ACOS@ef2367d50158ff863472f909320c494729c9b895"
    },
    {
      "type": "git-evidence",
      "value": "aerovista-us/ACOS@c908195c12a15d198082857c84d111f15a0b4da8"
    },
    {
      "type": "git-evidence",
      "value": "aerovista-us/nxcore@60655fc6aaa3f588ad83d9d6a066caef2498d341"
    },
    {
      "type": "git-evidence",
      "value": "aerovista-us/RydeSync@d13910b17ae5b47c9734e54d019d00165f7f2dba"
    },
    {
      "type": "git-evidence",
      "value": "aerovista-us/workspaces@2bfd7fdfe547cc175067a5c30fc53b3c9bca21df"
    }
  ]
}
